{
	"assertions": {
		"root_child_count_min": 1,
		"root_contains_node_type": "model_block",
		"tree_not_null": true
	},
	"category": "smoke",
	"description": "Smoke test: load prisma and parse a simple snippet",
	"id": "smoke_prisma",
	"language": "prisma",
	"source_code": "model User { id Int @id }",
	"tags": ["smoke"]
}
