{
	"assertions": {
		"has_error_nodes": true,
		"root_child_count_min": 1,
		"tree_not_null": true
	},
	"category": "smoke",
	"description": "Smoke test: load hyprlang and parse a simple snippet",
	"id": "smoke_hyprlang",
	"language": "hyprlang",
	"source_code": "general { border_size = 1 }",
	"tags": ["smoke"]
}
