{
	"assertions": {
		"root_child_count_min": 1,
		"root_contains_node_type": "named_node",
		"tree_not_null": true
	},
	"category": "smoke",
	"description": "Smoke test: load query and parse a simple snippet",
	"id": "smoke_query",
	"language": "query",
	"source_code": "(identifier) @name",
	"tags": ["smoke"]
}
