{
	"assertions": {
		"root_child_count_min": 1,
		"root_contains_node_type": "function_declaration",
		"tree_not_null": true
	},
	"category": "smoke",
	"description": "Smoke test: load hack and parse a simple snippet",
	"id": "smoke_hack",
	"language": "hack",
	"source_code": "<?hh\nfunction main(): void {}",
	"tags": ["smoke"]
}
