{
	"assertions": {
		"root_child_count_min": 1,
		"root_contains_node_type": "variable_setting",
		"tree_not_null": true
	},
	"category": "smoke",
	"description": "Smoke test: load readline and parse a simple snippet",
	"id": "smoke_readline",
	"language": "readline",
	"source_code": "set editing-mode vi",
	"tags": ["smoke"]
}
