{
	"assertions": {
		"root_child_count_min": 1,
		"root_contains_node_type": "extends_statement",
		"tree_not_null": true
	},
	"category": "smoke",
	"description": "Smoke test: load gdscript and parse a simple snippet",
	"id": "smoke_gdscript",
	"language": "gdscript",
	"source_code": "extends Node\nfunc _ready():\n\tpass",
	"tags": ["smoke"]
}
