{
	"assertions": {
		"root_child_count_min": 1,
		"tree_not_null": true
	},
	"category": "smoke",
	"description": "Smoke test: load linkerscript and parse a simple snippet",
	"id": "smoke_linkerscript",
	"language": "linkerscript",
	"source_code": "SECTIONS { .text : { *(.text) } }",
	"tags": ["smoke"]
}
