{
	"assertions": {
		"root_child_count_min": 1,
		"root_contains_node_type": "list",
		"tree_not_null": true
	},
	"category": "smoke",
	"description": "Smoke test: load yuck and parse a simple snippet",
	"id": "smoke_yuck",
	"language": "yuck",
	"source_code": "(defwidget main [] (label :text \"hi\"))",
	"tags": ["smoke"]
}
