{
	"assertions": {
		"root_child_count_min": 1,
		"root_contains_node_type": "section",
		"tree_not_null": true
	},
	"category": "smoke",
	"description": "Smoke test: load rst and parse a simple snippet",
	"id": "smoke_rst",
	"language": "rst",
	"source_code": "Hello\n=====\n\nWorld",
	"tags": ["smoke"]
}
