{
	"assertions": {
		"root_child_count_min": 1,
		"root_contains_node_type": "fn_define",
		"tree_not_null": true
	},
	"category": "smoke",
	"description": "Smoke test: load llvm and parse a simple snippet",
	"id": "smoke_llvm",
	"language": "llvm",
	"source_code": "define i32 @main() { ret i32 0 }",
	"tags": ["smoke"]
}
