{
	"assertions": {
		"root_child_count_min": 1,
		"root_contains_node_type": "config",
		"tree_not_null": true
	},
	"category": "smoke",
	"description": "Smoke test: load kconfig and parse a simple snippet",
	"id": "smoke_kconfig",
	"language": "kconfig",
	"source_code": "config FOO\n\tbool \"Enable foo\"",
	"tags": ["smoke"]
}
