{
	"assertions": {
		"root_child_count_min": 1,
		"root_contains_node_type": "property",
		"tree_not_null": true
	},
	"category": "smoke",
	"description": "Smoke test: load properties and parse a simple snippet",
	"id": "smoke_properties",
	"language": "properties",
	"source_code": "key=value",
	"tags": ["smoke"]
}
