{
	"assertions": {
		"root_child_count_min": 1,
		"root_contains_node_type": "program_definition",
		"tree_not_null": true
	},
	"category": "smoke",
	"description": "Smoke test: load cobol and parse a simple snippet",
	"id": "smoke_cobol",
	"language": "cobol",
	"source_code": "       IDENTIFICATION DIVISION.\n       PROGRAM-ID. HELLO.",
	"tags": ["smoke"]
}
