{
	"assertions": {
		"root_child_count_min": 1,
		"root_contains_node_type": "pattern",
		"tree_not_null": true
	},
	"category": "smoke",
	"description": "Smoke test: load gitattributes and parse a simple snippet",
	"id": "smoke_gitattributes",
	"language": "gitattributes",
	"source_code": "*.txt text",
	"tags": ["smoke"]
}
