{
	"assertions": {
		"root_child_count_min": 1,
		"root_contains_node_type": "design_unit",
		"tree_not_null": true
	},
	"category": "smoke",
	"description": "Smoke test: load vhdl and parse a simple snippet",
	"id": "smoke_vhdl",
	"language": "vhdl",
	"source_code": "entity main is end main;",
	"tags": ["smoke"]
}
