{
	"assertions": {
		"root_child_count_min": 1,
		"root_contains_node_type": "statement_list",
		"tree_not_null": true
	},
	"category": "smoke",
	"description": "Smoke test: load powershell and parse a simple snippet",
	"id": "smoke_powershell",
	"language": "powershell",
	"source_code": "Write-Host 'hello'",
	"tags": ["smoke"]
}
