{
	"assertions": {
		"root_child_count_min": 1,
		"root_contains_node_type": "Decl",
		"tree_not_null": true
	},
	"category": "smoke",
	"description": "Smoke test: load zig and parse a simple snippet",
	"id": "smoke_zig",
	"language": "zig",
	"source_code": "pub fn main() void {}",
	"tags": ["smoke"]
}
