{
	"assertions": {
		"root_child_count_min": 1,
		"root_contains_node_type": "package_declaration",
		"tree_not_null": true
	},
	"category": "smoke",
	"description": "Smoke test: load odin and parse a simple snippet",
	"id": "smoke_odin",
	"language": "odin",
	"source_code": "package main",
	"tags": ["smoke"]
}
