{
	"assertions": {
		"root_child_count_min": 1,
		"root_contains_node_type": "pattern",
		"tree_not_null": true
	},
	"category": "smoke",
	"description": "Smoke test: load gitignore and parse a simple snippet",
	"id": "smoke_gitignore",
	"language": "gitignore",
	"source_code": "*.o\n*.log",
	"tags": ["smoke"]
}
